"HITId","HITTypeId","Title","Description","Keywords","Reward","CreationTime","MaxAssignments","RequesterAnnotation","AssignmentDurationInSeconds","AutoApprovalDelayInSeconds","Expiration","NumberOfSimilarHITs","LifetimeInSeconds","AssignmentId","WorkerId","AssignmentStatus","AcceptTime","SubmitTime","AutoApprovalTime","ApprovalTime","RejectionTime","RequesterFeedback","WorkTimeInSeconds","LifetimeApprovalRate","Last30DaysApprovalRate","Last7DaysApprovalRate","Input.topic","Answer.Age","Answer.Education","Answer.Feedback","Answer.FieldOfStudy","Answer.Gender","Answer.HouseHoldIncome","Answer.WritingTexts","Answer.userId","Approve","Reject"
"3WYZV0QBFJT2Q6V4HNQ1FV76DX9BXK","39ZZP62BQX0QU628HEA3Y8AHB2EZVP","Write an article about a specific topic","In this task you are required to research information about a given topic and write a summary text. In addition you are asked to install a browser extension that will analyze your behaviour.","writing, summary, research","$1.00","Mon Jul 20 09:31:01 PDT 2015","3","BatchId:2025288;","3600","1209600","Mon Jul 27 09:31:01 PDT 2015","","","37ZHEEHM6X26VGJUAJCZSXSPY6O377","A1KFQGDO50WAAK","Submitted","Sun Jul 26 23:08:42 PDT 2015","Sun Jul 26 23:12:44 PDT 2015","Sun Aug 09 23:12:44 PDT 2015","","","","242","0% (0/0)","0% (0/0)","0% (0/0)","Suppose you have earned a Masters degree in Business. You want to find information to help you decide whether it is worth getting a PhD in Business or not. Find web pages that will help with a cost/benefit analysis of advanced education in Business.","27","Bachelors degree","VERY NICE TOPIC","SOCIAL SCIENCE","Female","$25,000 - $37,499","Becoming a professor of business means investing years of study before obtaining the desired degree, but academia offers many benefits, including: attractive salaries, the combination of varied activities in one career, However, following through with a PhD degree can be challenging not only because of the academic rigour but also due to the pressure and stress that comes from conducting research and defending a dissertation. Moreover, once a person obtains a PhD, there is no guarantee that even with an offer from a business school, that the PhD student will go on to publish his or her research in a top journal, will be able to teach effectively, or will receive a tenured faculty position.

Still, for those who have the motivation, drive and stamina to be successful in this field, there are many benefits. The life of a business professor is markedly different from a corporate career. An academic has more time to explore his or her own interests, pursues research, and rarely has a 'nine to five' type of career. Being a professor is much like being an entrepreneur , Success is based on the individual, and faculty are often their own bosses. Beyond being intellectually bright and able to conduct research, professors in business also need to be able to perform in the classroom. Teaching is a fundamental component of being a professor, though most faculty may only teach around 100 hours per year, the classroom setting can be challenging and often involve debate.

Not everyone can be a professor, but for those that have the skills required, it provides an excellent standard of living, with salaries comparable to the corporate Consulting, book publishing and speaking engagements can also further add to overall compensation. Academic institutions are often less vulnerable than corporations to forces like global economic downturns. Academia offers much in the way of financial stability.","RAPANDEEP"
"3WYZV0QBFJT2Q6V4HNQ1FV76DX9BXK","39ZZP62BQX0QU628HEA3Y8AHB2EZVP","Write an article about a specific topic","In this task you are required to research information about a given topic and write a summary text. In addition you are asked to install a browser extension that will analyze your behaviour.","writing, summary, research","$1.00","Mon Jul 20 09:31:01 PDT 2015","3","BatchId:2025288;","3600","1209600","Mon Jul 27 09:31:01 PDT 2015","","","3TPZPLC3M1SV1MNU656GSJJAY023PM","ARVZ72GWXS3KN","Submitted","Sun Jul 26 08:29:58 PDT 2015","Sun Jul 26 08:50:11 PDT 2015","Sun Aug 09 08:50:11 PDT 2015","","","","1213","0% (0/0)","0% (0/0)","0% (0/0)","Suppose you have earned a Masters degree in Business. You want to find information to help you decide whether it is worth getting a PhD in Business or not. Find web pages that will help with a cost/benefit analysis of advanced education in Business.","33","Some college, no degree","{}","{}","Male","Less than $12,500","Studying for a business PhD may be among the finest decisions you will make for your job. A lack of business professors means that career opportunities in this area are better than ever. Whether you decide to enter academia or private industry, a small business PhD is a formidable qualification that can open many doors. Yet, there are prices to earning a PhD that must be completely considered. Below you can find more about the pros and cons of finishing a small business PhD.

Pros to obtaining your PhD

1. Business Professors are in High Demand
There are a number of reasons for this scenario. Primarily, the number of pupils enrolling in business courses has considerably grown. Unlike other academic subjects just a relatively modest fraction of these pupils will pursue academic roles themselves as the private sector will be joined by many. Secondly lots of the present business faculty are retiring. These factors have lead to a strong demand for folks holding company PhDs.

2. Shortage Of Business Professors Leads To High Typical Salaries
With close to a six number starting wages due to the demand for business professors and with a relative lack of capable faculty, there's a high average wages for the profession, in reality, many company professors start. This salary can be further supplemented by consulting, writing textbooks, and summer teaching places. As a consequence becoming a business professor might be an extremely profitable profession.

3. Rewarding Career With Great Lifestyle
Becoming a small business professor supplies with you the possibility to relish a rewarding career using a lifestyle that few other jobs can match. As a business professor you can help shape the minds of a future generation of business leaders. The job enables professors to share those thoughts with a wider audience and to pursue the ideas that interest them.

4. Chances Outside Of Academia
One of the best things about possessing a small business PhD is that the opportunities are not restricted to a life in academia. Getting a business PhD illustrates a high degree of academic skill and knowledge. A business PhD may cause quite profitable work in investment banking, consulting and other sectors of private industry. Those with business PhDs additionally regularly go onto working for the government and organisations such as the World Trade Organization and also the International Monetary Fund.

5. Costs Of Getting A Business PhD
The complete prices should be evaluated before embarking on a PhD program. Yet pupils who are totally self-financing will have to settle the entire class fees. The cost of these fees will depend on which areas you are contemplating studying and where you're living. It will vary according to whether you're full or a part time pupil. Fulltime pupils for EU or UK students can expect to pay study. between GBP3,000 - GBP4,000 for full-time For non UK or EU students of studying for a business PhD the cost will generally be around GBP10,000 a year.

Would-Be company PhD students also need to take into account how much the opportunity costs in terms of time till they choose to analyze. A small business PhD will typically take around three years to complete if studying full time. Obviously, most PhD students will earn some type of income in this three year period, frequently working at the university. Then will cancel the loss of wages over this period. A PhD candidate gets GBP15,000 a year during their studies, then the true opportunity cost is just GBP45,000., if we contemplate that working part time Most company PhD students are readily able to recoup their lost gains within the space of a couple years of completing their PhD.

Is the investment worth it?
Obtaining a business PhD requires a substantial investment when it comes to time, money and energy as you are able to observe. However, the pay off for finishing the qualification may be equally substantial. Having a business PhD opens up a universe of rewarding and quite fulfilling career opportunities - and is an academic path well worth taking.","a1bc989d7fee35d06ce4e6ad3b599163ebd616c5eda632bc2deb5fcc0283f71"
"3SR6AEG6W591HOO0MBMZKKHDAG7YHS","39ZZP62BQX0QU628HEA3Y8AHB2EZVP","Write an article about a specific topic","In this task you are required to research information about a given topic and write a summary text. In addition you are asked to install a browser extension that will analyze your behaviour.","writing, summary, research","$1.00","Mon Jul 20 09:31:01 PDT 2015","3","BatchId:2025288;","3600","1209600","Mon Jul 27 09:31:01 PDT 2015","","","3IAS3U3I0GW4CAQ1J0AAEP9TBI8B2J","ARVZ72GWXS3KN","Submitted","Sun Jul 26 18:21:05 PDT 2015","Sun Jul 26 18:55:23 PDT 2015","Sun Aug 09 18:55:23 PDT 2015","","","","2058","0% (0/0)","0% (0/0)","0% (0/0)","Suppose you are writing an essay about a tax on ""junk food"".  In your essay, you need to argue whether it's a good idea for a government to tax junk food and high-calorie snacks. Find web pages supporting an argument in favor of a junk food tax.","33","Some college, no degree","{}","{}","Male","Less than $12,500","A controversial post printed in the June edition of Mayo Clinic Proceedings looks at how ""sin taxes"" - taxes on cigarettes, alcohol, sugary drinks and greasy foods - might be utilized to greatly enhance public health, as well as generate much-needed government revenue which (you'd hope) could be put back into health promotion.

After all, the risk factors for our most common chronic diseases are all related to drinking smoking, poor eating habits and lack of physical action.

Assuming the absurd subsidization of tobacco and sugar growing continues (for whatever concealed political reasons), sin taxes would change 3 of those 4 behavioral determinants of health.

And while I do not believe ""sin tax"" is the proper label here, it is certainly more memorable than ""Pigovian tax"" (after economist Arthur Pigou)- although I can give it a try.

Based on what the Mayo Clinic article writers, Dr. Michael Joyner and Dr. David Warner have discussed, here's 6 reasons a Pigovian tax on junk-food could work:

#1 We've been ""nannyed"" on tobacco and booze for decades - it works.

Taxes on tobacco and alcohol are (and have been) exceptionally successful in improving public health. There is a clear beneficial relationship between cost and tobacco consumption, and cost and alcohol consumption.

Imagine the public health developments that could be achieved with a junk food tax.

#2 Potential health benefits warrants a trial

Of course, whether a cost-increase on sugar and bad fats would influence consumption is debatable because we do not have signs yet. It simply hasn't been trialled properly at this phase.

But it's definitely not a brand new thought, and Mayor Bloomberg is still summoning to give it a trial with sugar-sweetened drinks. Furthermore, many say it will not work because junk foods are not addictive like cigarettes or alcohol, but I beg to differ.

The authors wrote, ""Given the significant role that consumption of these beverages plays in the obesity epidemic, the possible health benefits warrant additional exploration (of a junk-food tax).""

#3 We can learn from the mistakes of others

A tax on junk food isn't old. And France now has a successful tax on sugar-sweetened beverages. The UK, Switzerland and Germany are considering fat taxes.

And while the Danish fat-tax stopped this year, most of the reasons behind this conclusion would not always be reproduced here.

As an example, the primary difference between the Unites States and Denmark is so the inclusion of additional tax on fat proved to be a greater fiscal burden that the Danes already have one of the peak tax rates in the world. Additionally, Danes had been just crossing the border to Germany or Sweden to buy food (where prices are as much as 20 percent more economical).

We currently have a great case-study laid out before us in which we can assess what works and what does not.


#4 Sin taxes raise essential money - a LOT of it

Increase the tobacco tax by 50 cents per pack, and it'd raise $80 billion over the next ten years. Increase alcohol tax to 30% (it is now at 10%), and over the exact same time period $250 billion would be created. Not just pennies.

Joyner and Warner go on to estimate the effects of a 1 cent per ounce tax on sugary drinks would raise about $15-20 billion per year ($150 billion to $200 billion over 10 years).

And as a real-life example, we know that when Denmark's ""fat tax"" was in motion, it raised about $200 million in that one year. In the event the United States introduced a tax on high saturated fat food, it's estimated to generate $120 billion over a decade, given the population is about 60 times that of Denmark.

If we sum the approximations of these 4 sin taxes up, we are looking at about $600 billion or more of increased earnings over 10 years.

It is a substantial chunk of the increased sales politicians are discussing for the federal budget.

#5 Added earnings may be utilized to improve public health

The extra sales generated could likewise be utilized to further improve public health as I mentioned in the initial sentence.
Joyner and Warner suppose the escalation in resources could, ""Subsidize attention for the uninsured, buffer the fiscal pressures associated with Medicare and Medicaid, encourage increased physical activity and better nutrition in the population, construct public health infrastructure, or maybe increase federal funding for biomedical research.""

Of course we need to be realistic - sustained political pressure would be demanded for the tax dollars to actually be invested in well-being over the long term, rather than on other areas that are more significant. The military budget for example... ahem.

#6 Sin taxes aren't new to America

(I do not actually agree with the writers that this point is a valid reason, but I thought it fascinating however.)

From its modest beginnings, sin taxes have been used by the US as a major source of government revenue.

Had personal income tax not been created through the 16th Amendment in 1913, Prohibition wouldn't financially impossible.

Additionally, it is considered Prohibition was suddenly ended due to the demand for additional tax revenues in 1933.

Thus, you can view that sin taxes form a large phase in US history and should not be viewed as a strange concept that is new.","a1bc989d7fee35d06ce4e6ad3b599163ebd616c5eda632bc2deb5fcc0283f71"
"3SR6AEG6W591HOO0MBMZKKHDAG7YHS","39ZZP62BQX0QU628HEA3Y8AHB2EZVP","Write an article about a specific topic","In this task you are required to research information about a given topic and write a summary text. In addition you are asked to install a browser extension that will analyze your behaviour.","writing, summary, research","$1.00","Mon Jul 20 09:31:01 PDT 2015","3","BatchId:2025288;","3600","1209600","Mon Jul 27 09:31:01 PDT 2015","","","3U5NZHP4LSIAVUUTLQVIWDKKH5BPH6","A1KFQGDO50WAAK","Submitted","Sun Jul 26 22:44:58 PDT 2015","Sun Jul 26 23:00:26 PDT 2015","Sun Aug 09 23:00:26 PDT 2015","","","","928","0% (0/0)","0% (0/0)","0% (0/0)","Suppose you are writing an essay about a tax on ""junk food"".  In your essay, you need to argue whether it's a good idea for a government to tax junk food and high-calorie snacks. Find web pages supporting an argument in favor of a junk food tax.","27","Bachelors degree","GOOD IDEA TO GET VIEWS","SOCIAL SCIENCE","Female","$12,500 - $24,999","EVERY GOVT RUN BY THE TAX..THE SOURCE OF EARNING IS IMPOSED TAX ON ALL TYPE OF ITEMS WHICH ARE SAIL IN PUBLICLY . WHETHER THE ITEMS ARE JUNK FOOD AND OTHERS. IN MODERN SOCIETY JUNK FOOD IS MUCH MORE POPULAR THAN THE OTHER FOOD ,AND THE PEOPLE LIKE MORE JUNK FOOD AND THE SALE OF JUNK FOOD MUCH HIGHER. THE GOVT HAD A GOOD SOURCE TO GERMINATE MONEY BY TAXES AND CAN DO OTHER WELFARE WORK. BUT THE MOST FOOD EXPERT SAYS THAT THE JUNK FOOD IS VERY HARMFUL FOR PEOPLE WHO EAT REGULARLY AND CAUSE OF MANY DAISES.KEEPING IN VIEWS OF EXPERTS THE GOVT SHOULD IMPOSE MORE TAXES FOR THE SAY OF LIFE OF PEOPLE. THERE IS A RULE OF EACH COUNTRY WHO EARN THE MONEY HAVE TO PAY TAXES AND HELP THE GOVT TO GENERATE MORE MONEY .THANKS","RAPANDEEP"
"3EHVO81VN514RIDXAMFQ6X633VZ1HY","39ZZP62BQX0QU628HEA3Y8AHB2EZVP","Write an article about a specific topic","In this task you are required to research information about a given topic and write a summary text. In addition you are asked to install a browser extension that will analyze your behaviour.","writing, summary, research","$1.00","Mon Jul 20 09:31:01 PDT 2015","3","BatchId:2025288;","3600","1209600","Mon Jul 27 09:31:01 PDT 2015","","","3U84XHCDIDTAXM84TS91TMDUMZQZ49","ARVZ72GWXS3KN","Submitted","Sun Jul 26 18:34:23 PDT 2015","Sun Jul 26 18:59:42 PDT 2015","Sun Aug 09 18:59:42 PDT 2015","","","","1519","0% (0/0)","0% (0/0)","0% (0/0)","For economic reasons, you wish to switch from regular phones to internet phone services. You want to know: the best internet phone services, the cheapest internet phone services, the providers of VOIP internet phone services, features that great VOIP services have, providers that offer free calls from the US to some European countries, expert reviews about VOIP providers.","33","Some college, no degree","{}","{}","Male","Less than $12,500","obile phones have taken over the planet, and there is no denying their convenience and functionality. However, some people still need the dependability of a great old-fashioned landline. And for most businesses, landlines are essential. You can nevertheless get a landline number from your local telephone or cable operator-- Verizon, AT&T, Comcast, Time Warner, as well as the remainder. However you can do better than that: You can make use of a lower-cost VoIP service which takes advantage of your broadband Internet connection to provide you with dependable phone service.

VoIP is normally very easy to set up: You get unique phone adapter unit or a carton from the service provider, plug it into power, your Internet router, plus a typical telephone handset. An option that's becoming less common would be to purchase a SIP phone, which includes electronic equipment enabling it to sidestep the need for the adapter.

The price differences between VoIP and normal landline services are truly significant: For example, in the New York region, a Verizon Freedom Value strategy that includes unlimited local and long-distance calling costs $59.99 per month. So you're taking a look at upwards of $50 only for landline service from the conventional Ma Bell duopoly. And you can get infinite U.S. and Canada calling with Skype, plus an inbound set phone number for only $7.95 per month.

Do VoIP services cost less than standard phone line services, however they also add features on top of what you get from the legacy suppliers. For example, PhonePower gets you an onscreen program that allows you to receive and make calls from your desktop computer. Vonage Android that act as extensions to your primary telephone and offers cellular programs for iOS. And both give you Web access to your voicemail and call history, and allow you to receive faxes to an email address. Skype is actually better known for its video phoning than its conventional telephone system capacities, and rich text messaging is also offered by that service. A great feature in all of these is ""telephone hunt"" which calls multiple telephones or apps until you pick up, or sends the call to voicemail. In addition, you get caller obstructing, three-way calling, and call.

Company VoIP
The business-focused entrants in this roundup, as you might anticipate, go considerably farther in added capacities, functioning as cloud-based PBXes (public branch exchanges). These let your organization present a professional look to the calling world, with features like call-routing, automated attendants, call record, and conference call bridges. They typically offer several pricing levels predicated on the number of lines needed, ranging from about $20 per line for big organizations to $35 per line for smaller groups; you also pay more for some extra features like integration with cloud company services for example Salesforce.com. For a superb summary of company VoIP, read the Phone Cord: Cutting on.

Emergency Calling: 911 and E911
Emergency service telephoning is an issue that VoIP providers used to really have a difficulty with, but for which they've now come up with a working alternative --with the important exception of Skype, which doesn't necessitate a separate telephone adapter box. You now have to define an address for 911 service when you sign up for Vonage or its ilk.

You could certainly get away with having a cellular as your only phone. But landline service retains its advantages, including never having to worry about how powerful your cell signal is or whether your battery has any charge made. Landlines and VoIP also have a tendency to provide sound that is dependable and clearer at all times. Look through our outlines of the finest VoIP services about, if those features have indisputable appeal for you.


RingCentral

Businesses, whether they're little shops or big corporations looking to replace their on-premises PBX hardware, can find anything they want in this full-service company VoIP provider. RingCentral will send you SIP business phones preconfigured to work with your company's account, making setup a no-brainer. Direction features like call transfer, screening, park, and logs come standard. The service also integrates with Microsoft Office, Outlook, Google, Carton, and Dropbox. Upgrades can add things like multilevel attendant functionality and automatic call record. In the event you are a company searching for a full-featured, easy-to-set-up VoIP system, RingCentral is worth serious thought.


Skype

Skype is well known to all as a way to make video calls over your PC, but nonetheless, it also lets you connect to regular landline telephones and mobiles as a VoIP service. Skype is a communication Swiss Army Knife-- pay or don't, and use all of it or merely a few of its own tools.


PhonePower

PhonePower strongly resembles Vonage among the VoIP providers included here. The organization sends you a box into which you plug your broadband Internet connection along with a conventional phone line. But PhonePower allows you to utilize a software phone to make calls from your PC and costs less than Vonage. While this service might not be quite as clever as Vonage, it provides characteristics that are desirable at a value that is very good.


Jive Hosted VoIP

Jive Communications offers most of the attributes seen in RingCentral, but it trails the latter of interface in ease of use and slickness. Call queues and call recordings, voicemail-to- mobile apps, email, and yet the capacity to eavesdrop on workers are among the many company characteristics of Jive. But setting up many multiple users is more of a chore than in RingCentral, and its particular management web site is more unresponsive.


Vonage

In case you have heard of only one VoIP service, it is Vonage. The business is going to send you an adapter box that's dirt easy to connect to broadband Internet and your telephone. The organization offers a Web interface that is polished, good call quality, and cellular programs that let your smartphone act as an extension of your line. Call Hunt and its SimulRing attributes ease multiple device use, and you also get other perks like discerning amount three-way calling, and call forwarding. However, the service is a bit on the expensive side, unless you pay for an extra line, and you also don't get a software mobile.","a1bc989d7fee35d06ce4e6ad3b599163ebd616c5eda632bc2deb5fcc0283f71"
