"HITId","HITTypeId","Title","Description","Keywords","Reward","CreationTime","MaxAssignments","RequesterAnnotation","AssignmentDurationInSeconds","AutoApprovalDelayInSeconds","Expiration","NumberOfSimilarHITs","LifetimeInSeconds","AssignmentId","WorkerId","AssignmentStatus","AcceptTime","SubmitTime","AutoApprovalTime","ApprovalTime","RejectionTime","RequesterFeedback","WorkTimeInSeconds","LifetimeApprovalRate","Last30DaysApprovalRate","Last7DaysApprovalRate","Input.topic","Answer.Age","Answer.Education","Answer.Feedback","Answer.FieldOfStudy","Answer.Gender","Answer.HouseHoldIncome","Answer.WritingTexts","Answer.userId","Approve","Reject"
"33TGB4G0LPX2MSPLH9HMFPDSJ48TXR","39ZZP62BQX0QU628HEA3Y8AHB2EZVP","Write an article about a specific topic","In this task you are required to research information about a given topic and write a summary text. In addition you are asked to install a browser extension that will analyze your behaviour.","writing, summary, research","$1.00","Mon Jul 20 09:31:01 PDT 2015","3","BatchId:2025288;","3600","1209600","Mon Jul 27 09:31:01 PDT 2015","","","3JWH6J9I9TT01WFU5J8U6DCRMCDBNM","ARVZ72GWXS3KN","Submitted","Sun Jul 26 07:55:40 PDT 2015","Sun Jul 26 08:29:46 PDT 2015","Sun Aug 09 08:29:46 PDT 2015","","","","2046","0% (0/0)","0% (0/0)","0% (0/0)","A friends of yours mentioned that glass and scientific advances have gone hand-in-hand throughout history with many notable examples such as Edison's light bulb. You want to collection some information about scientific glassblowing throughout the centuries.","33","Some college, no degree","{}","{}","Male","Less than $12,500","The earliest recorded usage of glass was by the Egyptians who used it to glaze tiles, make amounts and create the first beads. The Phoenicians used blocks of pop to support their cooking containers and the mix of heat, sand and pop is reported as signs that they found this magic material. Following experiments to duplicate the Phoenician ""discovery"" have been unsuccessful. History shows that in the era about the time of the birth of Christ, given Man's imagination, and the combination of fire, civilization entered into an age where glass emerged as both a practical and cosmetic stuff. Who was the first to use this marvelous stuff? The answer is not as important as the diverse used that Man has devised to use it, for it definitely would be a distinct world without it!!

Whether by design, or perhaps by accident, Guy found that if he applied heat and and other substances combined sand, he could fuse, or melt, this combination of materials and when they cooled, they held their form as well as color. I prefer to link the first making of glass to the potter, who realized that by simply making a paste from sand and oil, then painting this glassy substance onto the surface of his beads, pots and vessels before firing, it enhanced their beauty and opened up a new process of decorating his products. Even now the potter uses a similar glaze beautify and to seal his pots. The primeval temples are abundant in glazed tiles, adding color and layout to walls and the floors, but creating a more durable surface that would resist wear from the sandaled feet of the worshipers. So successful was the utilization of these glazes that to this day, archaeologists are unearthing tiled floors that have the exact same sparkle as well as color as the day they were put down.

How excited the craftsman must have been - he was now able to create a container that would carry tinctures, the oils and potions of the day, and not like the clay pots he was proficient in making consume them.seed glass

Early glass vessels are extremely unlike glass as we all know it now. They were not clear, full of seeds of undissolved sand and full of bubbles trapped in the thawing process. However, Guy was on the course to developing what was to be a common part of our daily lives.

It seems no secret for the primary source of early glass has been into the graves of the rulers of the land from excavations that glass was the mark of the wealthy and noble. The Vatican Museum exhibits glass vials unearthed in the Catacombs. They are seedy, bubbly glass containers used by the early Christians to carry their oils and potions. Just by examining the contours of these relics, we're able to determine the glass workers of that time were using tools that even today are being used in the glass shops all around the world. Repeating this age old procedure presents a challenge to Mans genius even now, and also the advance of glass technology bears witness to this fact.

In the second century AD, the usage of glass spread through the Middle East. It was a trade item that is major, in the type of beads, jugs, bottles and amulets. It went with traders and the explorers of the time to the Far East, and, as its use spread, so, also did the centres of manufacture. The Greeks made early glassware that shows signs of being created on a pipe. They developed the decorations of their glass vessels to a fine art. Some unearthed Greek containers defy producing even today. In time the forms became more distinct and diverse and by the Fourth Century, drinking glasses and wine bottles were becoming common. So, also, was their price lowered, by refining the processes to make these things. Now, bottles, cups, goblets, vases and glass containers became more available. Rich and vibrant colors were created by adding silver, gold, cobalt, and, yes iron to the melt. These decorations enabled them to fashion and decorate into beads and stones to adorn the body.

tank

Although there were many facilities for glass creation, a center in Venice, Italy soon was to dominate the craft of the time. Great sands and also the presence of woods to provide the fuel for the fires made Venice the perfect place to construct the glass houses of the time. About 1400 AD, there was such a concentration of glass houses in the city, in fact, that it absolutely was decided to move this concentration of infernos in the bay, outside to the isle of Murano, away from the growing city. They remain there now. The merchants of Venice, with their small ships plying the trade routes both East and West were quick to realize that the glass made in the glass houses of Murano has a ready marketplace. Here was a product of great value - it could be traded for GOLD! The retailers recognized that by doing so, they were trying to prevent competition and keep up their monopoly.

So, also, started the ferocious attempts to gain the ""secrets"" of the Italian glass houses, by coaxing, or even in some events kidnapping glass workers, the functioning technology distribute to the North. It went to Germany, France and areas in mid-Europe, where the sands and forests stood prepared to embrace this new technology. Alas, the very act of trying to keep a monopoly had created an atmosphere whereby it was unavoidable that it would be lost. The fires of Venice were producing glass on an enlarged scale and also the merchants became wealthier and their trade routes became bigger. Their successes were doomed.

The Venetians were not able to stop the motion of their techniques and the glass workers. Shortly the glass houses of Murano succumbed to the competition of the German, the French and others, who by now duplicated and enhanced the capacities of the Venetians. Soon, the quest for the secrets of the trade reversed and Venice found itself searching the workers who by now had advanced a step ahead of those out. For example, inmedalion the creation of glasses for the great Cathedrals of France, French glass workers had made a new array of colours within their glasses. Their ability to create them was overcome by the demand for windows produced from the French glasses. Here was an efficient method of producing glass in level sheets! Having solved this issue, the European glass houses began creating a ton of level glass.

The whole world was the glass workers oyster at the moment! Both women as well as men too, for that matter, had an insatiable desire for objects to adorn the body as well as home. The Italian flair put emphasis on function as well as ornamentation and we see examples of a simple wine glass being graced with animals, fowl, flowers and figures. They were masters of the usage of shape and color and also the world is indebted to the Venetians for their contributions to the artwork. The political arena in Italy in the 17th Century found the taxing on glass and corruption in government ruin the glass industry until it ceased, not to climb for 150 years and it dropped.

Glass came to the New World additionally and the Founding Fathers were quick to realize this new nation would be a giant marketplace for the products of the glass houses. Workers were not export, bringing along with them the tools of their craft and glass houses were began in Jamestown shortly after the very first settlers arrived in this bulls eye virgin land. Here was the extensive woods for fuel for the fires, the excellent littoral, so all the requirements were in place to develop a nearby business. Starting up, nevertheless, was not immediately successful. The generation became more costly as well as as the forests disappeared, the Jamestown glass houses shut down. The Dutch Company in New York attempted subsidizing the start of several glass houses. They too struggled to get started. New Jersey and Pennsylvania had extensive forests and outstanding sands, so in glass production the glass houses of New Jersey commanded for several years. To the north in Massachusetts, on the Island of Sandwich, there arose a group of glass houses and the glass created there still bears its name. The brand new authorities were offering incentives to the glass houses to the produce window glass for the new colonies and, before long, the glass houses were turning out level panes of glass made by spinning molten glass on the end of the pipe, and cutting it into small panes when cool.

Modern day molding systems have tried to duplicate the appearance of the ""bulls eyes"", but cannot duplicate the break-away point in the center of the spin, its sharp edges signaling the cracking off of the spun disk from the iron conduit. Each spun centre is person and the thickness of its own variation and the glass gives colour gradations which defines its identity. Designs cut to the outer layer were enhanced by the contrast between the two glasses.

With typical ""Yankee ingenuity"" and spurred on by the need for glassware of all kinds, the early American glassworkers devised a method to squeeze hot glass between molds, producing what we currently know as ""pressed ware"". When designs cut into the moulds, the design was replicated giving a cut effect. Slogans and mottos cut to the moulds also produced dishes glass cups and vases with popular topics of the colonial days. These, too, are sought after items by present day collectors. The glass shops released a veritable deluge of glass to this prepared market.

Picture, in case you will, the time it would take to hand craft all of the glass insulators essential to support even a single telegraph wire across this vast land. With insulators positioned on the wires every 50 feet, the number becomes astronomical. The machines to form them were developed which enabled the advance of the telegraph lines to carry on as rapidly as the crews place the posts. America was no longer dependent on this baby business grew by leaps and bounds and the European glass houses.insulators

Meanwhile, for glass, another fairly different market developed in Europe in the post Renaissance years. Astronomy, Medicine, and the sciences of Chemistry and Physics were leading Europe from the Dark Ages into an era of light and knowledge. Man had analyzed the skies at night through the eras and by this time had just partly comprehended the heavens. His natural curiosity drove him to delve into the mysteries of the Universe. He understood that the drop of water magnified whatever it rested upon and together with the arrival of glass into his culture, he shortly discovered that here was a substance, not unlike the drop of water, that allowed him to examine the content under it. It enabled him to see details he could barely see with his naked eye!

When he turned a tube towards the heavens with lenses in it, he saw details! No one content in history has had such an impact on Man's search for advice - it could unlock the mysteries of the Universe, and used properly, turned out to be a key!

Refinements in the first simple microscopes shortly led to higher and higher powers of magnification and also the capability to see the hidden world about him led to the important breakthroughs and spiked his curiosity in understanding the causes of diseases that had plagued humankind through the ages. He investigated derivatives and the extracts that had come down through the ages. As we are aware of it now, by understanding them, he began down the trail to Medication. Inside, he could boil, evaporate, condense and keep them. The laboratories of the chemists of the time called upon the glass workers to create the particular tools used by the scientist and also a standard of types of glassware was ordained, giving rise to the beakers, flasks, bottles and vials today, we use even. There developed a way of glass working called the ""German Method"", an off hand technique using glass tube as an alternative to the conventional forming of glass from the molten tank.

The demand for precise tube and rods to fill the requirements of the scientific community resulted in the creation of glass tube drawing machines whereby a consistent size of tube may be produced in big quantities. The state of the craft went from a gob of glass stretched between two glass workers as they walked apart from each other to an upward draw machine which drew hot glass from a bud, stretching it vertically to some height were the top end would be cool enough to break away into four foot lengths. Absolutely, as complex a scheme as the upward draw tower is, it just represents the adaptation of a hand procedure. In practice, the bulk of mass production of glassware is a modification of the old hand procedure. Making tubing and pole of consistent diameters for volume measuring devices and thermometers demanded close tolerances until glass tube and rod was being drawn to allowances of less than a millimeter and it was not long.

Guy rose to take the challenge of fulfilling the increasing need for glass. By accommodating historical hand techniques, methods were devised to change the need for more people, into the dependence on more machines. A giant step was taken by him in time as of this point. Larger furnaces were assembled, loaded with sand (silica), and traces of lead,mould lime, soda along with other trace minerals, and heated to the molten state. A drain was put in the vat rather than have the glassblower dip to the vat of molten glass, as well as a continuous stream of molten glass, much like taffy that was hot, was drawn from the melt. This ribbon of hot glass was chopped into sections, dropped into molds (nearly as hot as the glass), as well as a plunger pushed to the mold to move the hot glass around until it filled the mold. Anyone who has ever stacked dishes can comprehend the process. Pile one cup into another which carries some liquid, and see the liquid rise throughout the second cup. It is possible to see the glass molding procedure done right before your eyes. It was that simple. Until then the process was very labor intensive. But now glassware could be produced by the machines in some instances unattended, around the clock. The resultant never-ending stream of dishes, light bulbs, bowls, flat plates and all the many sorts and forms of glass products, gave new life to what was to become sector.

Now here was a substance that has been simply ""tailor made"" for the scientific community in the pursuance of the character of the worlds treasures. Glass in its many forms was priceless in searching out the ""what and why"" of the things that helped as well as harassed mankind.

To examine the essence of the universe, scientists needed vessels, tubes, retorts, bottles, lenses and prisms, all to analyze things which might be quantified, adapted, and compounded. Glass has many unique properties desired to the scientist: the power to resist attack from virtually all chemical compounds, transparent, sturdy, inert, easily worked in its molten state, capable to be produced to close tolerances (making reproducible results possible in consecutive experiments), and neither adds to, or takes away anything stored inside it. So, when original research is underway, you are able to assume that the final results have been entered into by glass. When Dr. Jonas Salk set his Polio cultures in a sterile Petri dish, he understood there would not be any contamination from the host vessel. Not so with so many other mediums.

The staff glassblower adds her or his abilities to the research efforts of the chemist or physicist, bringing ideas to life, a link in the chain of talents crucial for success. Each had his or her speciality, so when a team, the ""hands on"" gifts of the glassblower lend support when needed. So to speak, to pass information along to the members. This information is priceless for members, as well as the regional and local meetings keeps members in touch with events and new developments, notwithstanding its societal worth.

Looking at man's advancement over time, we do well to note that pushing back the frontiers of science has enriched and fostered hope in our everyday lives, and assures that the same ardor for progress will continue forever.

Graphic a time when the world was dark, guy dwelt by the day hours, and expected the next dawn. He detected fire, then a method to burn a stick and create a feeble light. He must have thought ""nothing can get better than this"", then somebody discovered that fat burned off and made more light. WOW!

Another Pilgrim discovered the bees made a wax that would burn, and candles were born. WOW! Sailors found out that the oil of a whale combusted even more intense, along with the whaling business was created! WOW! Detecting by skimming it off with their blankets, the Indians who got the oil slick on creeks in Pennsylvania, a man dug a well so there was no need to really go to distant seas for whale oil, to locate oil here at home. The birth of Standard Oil! (As well as the demise of whaling) WOW plus.

Think of the as advancement, from whale oil for lighting, to the invention of the electric light, to the discovery of oil.

Ultimately, it was a glass envelope enclosing the filament that Thomas Edison brought really ""light to the world"". Any amount of experimental filaments, each fabricated right into a hand blown bulb, from silk, to carbon, to hair, to finally a tungsten cable. Many, many lightbulbs fell by the wayside. Also, the first light bulb was evacuated using the ""Toepler Pump"", a moving column of mercury to rid the lightbulb of oxygen. This pump consists of glass tube, and is in use in a few research procedures even now. It is the historic coming together of glass and electricity. A commendable start.

So, where did his glass envelop are got by Edison for his experiments? A glassblower, obviously, a crucial facilitator to research. This demand also extends even to today. We could associate the mass production of the myriads of glass contours to the adaptation of an initial 134 years""hand"" made prototype. Look in a wine shop to see how the wine industry has standardized on the shape of bottles. Someone had to say, ""this works, lets make a million of them"".

The very invention of the first hand made light bulb activated the boom effect in a number of businesses, besides creating the first light bulb industry. Glass must be made from the petroleum and coal business creating energy to heat these materials to bring glass, as well as elements dug in the ground, starting the mining sector. It had to be made available to fulfill an apprehensive need to any or all humans, once made. Many businesses were born as a consequence of Edison's single experiment that was successful. Even now, the light bulb is evolving, to some gasoline filled, coiled tube in the burning tungsten filament, and light emitting LED's. What is next?

Compare the rise in technology in the glass industry with any comparable industry and you'll observe that it's grown by bounds and leaps through the centuries. To make steel, for example, the process developed in the mid 19th century and to this day, the procedure has improved but little, the end product is the same as the day the Bessemer process was devised. Glass production, exceeded demands, as well as however has expected new needs and has kept up with. Initially, the soda lime, ""soft"" glass led the marketplace for laboratory glassware, then in the late 20's, the ""tough"" glass, PYREX was designed to avoid the railway lanterns from lens breakage in rainstorms. There is practically no kitchen that does not have an array of heat evidence ovenware.

The electronics industry has always cultivated demands for brand new and several types of glass, and now we find more and better glasses in the hands of millions in cells, tablet computers, computers, even up to the face plates on those giant television sets. Quartz ""boules"" are grown in intense heat to be eventually sliced into thin draw plates resulting in substrates for the application of circuits that make computers potential. They defy the constraints of production, so when the technology developed, and got more and more minimized, bigger ""boules"", when sliced, now accept an increasing number of individual integrated circuits. Think of the problems solved between rolled hot ""soft"" glass out on a surface such as the first glass workers did to ensure it is flat to making a cylinder of silica and slicing it to get a flat plate.

Historically, the glasses now we know will be the product of fulfilling with a need to produce life more productive and simpler. From your early, seedy vessel to the computer chip, maybe, like no other stuff, we are served by glass in our day-to-day lives. Glassblowers through the ages have worked with, and had the imagination to revive and enhance this ""magic"" stuff. They also have assisted, by executing their craft, to empower other people to expand their frontiers, in a sense that defines man's imagination and challenge to surpass.","a1bc989d7fee35d06ce4e6ad3b599163ebd616c5eda632bc2deb5fcc0283f71"
"33TGB4G0LPX2MSPLH9HMFPDSJ48TXR","39ZZP62BQX0QU628HEA3Y8AHB2EZVP","Write an article about a specific topic","In this task you are required to research information about a given topic and write a summary text. In addition you are asked to install a browser extension that will analyze your behaviour.","writing, summary, research","$1.00","Mon Jul 20 09:31:01 PDT 2015","3","BatchId:2025288;","3600","1209600","Mon Jul 27 09:31:01 PDT 2015","","","3Q5ZZ9ZEVPVD99BHY7SYLUM4N6F85N","A1OKTCXWVYNXE6","Submitted","Mon Jul 20 22:16:24 PDT 2015","Mon Jul 20 22:29:02 PDT 2015","Mon Aug 03 22:29:02 PDT 2015","","","","758","0% (0/0)","0% (0/0)","0% (0/0)","A friends of yours mentioned that glass and scientific advances have gone hand-in-hand throughout history with many notable examples such as Edison's light bulb. You want to collection some information about scientific glassblowing throughout the centuries.","34","Some college, no degree","{}","{}","Male","$50,000 - $62,499","Throughout all of human history, there have been many advances in the scientific world that would not have been possible without the use of glass.  Even though glass is only made from heated sand, it has provided humankind with many uses that scientists can then use to further our knowledge of the universe.  Take for example the work performed by glass in the telescope.
The telescope would not be possible without glass, by using the property of glass for magnifying objects, a telescope can view distances extremely far away.  One of mankind's biggest achievements is the Hubble Space Telescope which can view distances over 9 billion light years away.  And yet without glass, the Hubble Space Telescope would not be possible.   
At the other end of the spectrum, glass is also the key component in microscopes.  A microscope can magnify even the tiniest cell, and was the instrument which made possible the study of microbiology.  Without microscopes, we would not have learned that our bodies and all human living creatures are made of tiny single cells all working together to make a living specimen.
Glass has also played a major role in communication as fiber technology can transmit information across large spaces in a fraction of the time it would take without glass.  More and more telecommunication companies are making the switch to fiber technology due to the higher speeds allowed by the tech.
Yet another older, but just as important use of glass has been to help humans and their eyesight.  Glasses worn outside the eyes, as well as glass material worn as a contact lens, has helped many people to see 20/20.  Glass and the properties of light reflection and refraction have made scientific advances possible in a wide array of scientific subjects, ranging from deep space to the microscopic.","8f809eab27bddc8eeadb1622b16b4058c615f81d5dc237c49e33bad6f4d6f13"
